{
  "spec_version": "1.0.0",
  "card_type": "agent",
  "metadata": {
    "id": "00000000-0000-0000-0000-000000000000",
    "name": "evidence-collector",
    "owner": "grc-engineering@example",
    "created_at": "2026-09-07T21:02:56.140Z",
    "canonical_sha256": "0138d1361a98429a0fc6d23424f7385240d5720ca18ab4e3dd5b24c6260bcfc2"
  },
  "classification": {
    "risk_tier": "high",
    "next_review": "2027-03-01"
  },
  "autonomy": {
    "level": "supervised"
  },
  "tools": [
    {
      "name": "repo.list",
      "data_access": "read",
      "data_classes": [
        "repo_metadata"
      ],
      "requires_approval": false
    },
    {
      "name": "repo.read_settings",
      "data_access": "read",
      "data_classes": [
        "repo_metadata:colophon-demo-a",
        "repo_metadata:colophon-demo-b",
        "branch_protection:colophon-demo-a",
        "branch_protection:colophon-demo-b"
      ],
      "requires_approval": false
    },
    {
      "name": "fs.read",
      "data_access": "read",
      "data_classes": [
        "local_fixture"
      ],
      "requires_approval": false
    }
  ],
  "sandbox": {
    "write_paths": []
  },
  "decision_boundaries": [
    {
      "type": "tool_scope",
      "description": "may call 'repo.list' with 'read' data access"
    },
    {
      "type": "tool_scope",
      "description": "may call 'repo.read_settings' with 'read' data access"
    },
    {
      "type": "tool_scope",
      "description": "may call 'fs.read' with 'read' data access"
    },
    {
      "type": "data_class",
      "description": "may touch data class 'branch_protection:colophon-demo-a'"
    },
    {
      "type": "data_class",
      "description": "may touch data class 'branch_protection:colophon-demo-b'"
    },
    {
      "type": "data_class",
      "description": "may touch data class 'local_fixture'"
    },
    {
      "type": "data_class",
      "description": "may touch data class 'repo_metadata'"
    },
    {
      "type": "data_class",
      "description": "may touch data class 'repo_metadata:colophon-demo-a'"
    },
    {
      "type": "data_class",
      "description": "may touch data class 'repo_metadata:colophon-demo-b'"
    },
    {
      "type": "sandbox_path",
      "description": "no filesystem write paths granted"
    }
  ],
  "escalation": {
    "kill_switch": {
      "available": true,
      "mechanism": "operator revokes by deleting or invalidating the Card file passed to --card; the gate re-validates the Card at every startup and fails every call closed if it is missing or invalid"
    }
  },
  "governance": {
    "control_mappings": [
      {
        "framework": "NIST-AI-RMF",
        "ref": "GOVERN-1.1"
      },
      {
        "framework": "NIST-AI-RMF",
        "ref": "MANAGE-2.3"
      },
      {
        "framework": "ISO/IEC-42001",
        "ref": "8.3"
      }
    ]
  },
  "evidence": []
}
